{
  "title": "3  The Holy Spirit and the Covenant of Grace",
  "legacyPath": "/podcast/category/3-the-holy-spirit-and-the-covenant-of-grace",
  "datePublished": "2024-08-25 20:42:12",
  "authors": [
    "manuelkuhs@gmail.com"
  ],
  "tags": [],
  "rawCategories": [
    "2008"
  ],
  "primaryCategory": "2008",
  "section": "podcast"
}
