{
  "title": "2000:5 The Kingdom and Civil Government",
  "legacyPath": "/podcast/category/20005-the-kingdom-and-civil-government",
  "datePublished": "2024-08-25 16:02:25",
  "authors": [
    "manuelkuhs@gmail.com"
  ],
  "tags": [],
  "rawCategories": [
    "2000"
  ],
  "primaryCategory": "2000",
  "section": "podcast"
}
