{
  "title": "1992:4 The Covenant Children of Abraham",
  "legacyPath": "/podcast/category/19924-the-covenant-children-of-abraham",
  "datePublished": "2024-08-25 15:21:57",
  "authors": [
    "manuelkuhs@gmail.com"
  ],
  "tags": [],
  "rawCategories": [],
  "primaryCategory": null,
  "section": "podcast"
}
