{
  "title": "1994:2 Sovereign Grace and The Cross of Christ",
  "legacyPath": "/podcast/category/19942-sovereign-grace-and-the-cross-of-christ",
  "datePublished": "2024-08-25 15:34:36",
  "authors": [
    "manuelkuhs@gmail.com"
  ],
  "tags": [],
  "rawCategories": [],
  "primaryCategory": null,
  "section": "podcast"
}
