{
  "title": "2006:1 The History of Calvinism",
  "legacyPath": "/podcast/category/20061-the-history-of-calvinism",
  "datePublished": "2024-08-25 16:18:35",
  "authors": [
    "manuelkuhs@gmail.com"
  ],
  "tags": [],
  "rawCategories": [
    "2006"
  ],
  "primaryCategory": "2006",
  "section": "podcast"
}
