{
  "title": "4  The Reformed Believer and Money",
  "legacyPath": "/podcast/category/4-the-reformed-believer-and-money",
  "datePublished": "2024-08-25 20:54:34",
  "authors": [
    "manuelkuhs@gmail.com"
  ],
  "tags": [],
  "rawCategories": [
    "2010"
  ],
  "primaryCategory": "2010",
  "section": "podcast"
}
