{
  "title": "2014 Introduction: Zealous of Good Works",
  "legacyPath": "/podcast/category/2014-introduction-zealous-of-good-works",
  "datePublished": "2024-08-25 21:12:43",
  "authors": [
    "manuelkuhs@gmail.com"
  ],
  "tags": [],
  "rawCategories": [
    "2014"
  ],
  "primaryCategory": "2014",
  "section": "podcast"
}
