{
  "title": "1996:3 The Church: Its Nature",
  "legacyPath": "/podcast/category/19963-the-church-its-nature",
  "datePublished": "2024-08-25 15:43:54",
  "authors": [
    "manuelkuhs@gmail.com"
  ],
  "tags": [],
  "rawCategories": [
    "1996"
  ],
  "primaryCategory": "1996",
  "section": "podcast"
}
