{
  "title": "1992:6 The Covenant as a Pattern for Marriage",
  "legacyPath": "/podcast/category/19926-the-covenant-as-a-pattern-for-marriage",
  "datePublished": "2024-08-25 15:28:40",
  "authors": [
    "manuelkuhs@gmail.com"
  ],
  "tags": [],
  "rawCategories": [],
  "primaryCategory": null,
  "section": "podcast"
}
