{
  "title": "2012:2 The Content of the Witness",
  "legacyPath": "/podcast/category/20122-the-content-of-the-witness",
  "datePublished": "2024-08-25 21:04:49",
  "authors": [
    "manuelkuhs@gmail.com"
  ],
  "tags": [],
  "rawCategories": [
    "2012"
  ],
  "primaryCategory": "2012",
  "section": "podcast"
}
