{
  "title": "1996:2 The Church: Gathered by the Gospel",
  "legacyPath": "/podcast/category/19962-the-church-gathered-by-the-gospel",
  "datePublished": "2024-08-25 15:42:59",
  "authors": [
    "manuelkuhs@gmail.com"
  ],
  "tags": [],
  "rawCategories": [
    "1996"
  ],
  "primaryCategory": "1996",
  "section": "podcast"
}
