{
  "title": "2006:6 Preservation of the Saints",
  "legacyPath": "/podcast/category/20066-preservation-of-the-saints",
  "datePublished": "2024-08-25 16:23:15",
  "authors": [
    "manuelkuhs@gmail.com"
  ],
  "tags": [],
  "rawCategories": [
    "2006"
  ],
  "primaryCategory": "2006",
  "section": "podcast"
}
