{
  "title": "6  The Holy Spirit and the Church",
  "legacyPath": "/podcast/category/6-the-holy-spirit-and-the-church",
  "datePublished": "2024-08-25 20:45:31",
  "authors": [
    "manuelkuhs@gmail.com"
  ],
  "tags": [],
  "rawCategories": [
    "2008"
  ],
  "primaryCategory": "2008",
  "section": "podcast"
}
