{
  "title": "2004:2 Keeping God's Covenant in the Church",
  "legacyPath": "/podcast/category/20042-keeping-gods-covenant-in-the-church",
  "datePublished": "2024-08-25 16:14:26",
  "authors": [
    "manuelkuhs@gmail.com"
  ],
  "tags": [],
  "rawCategories": [
    "2004"
  ],
  "primaryCategory": "2004",
  "section": "podcast"
}
