{
  "title": "2014 Lord's Day Sermon: Only the Holy Shall Inherit the Kingdom",
  "legacyPath": "/podcast/category/2014-lords-day-sermon-only-the-holy-shall-inherit-the-kingdom",
  "datePublished": "2024-08-25 21:20:33",
  "authors": [
    "manuelkuhs@gmail.com"
  ],
  "tags": [],
  "rawCategories": [
    "2014"
  ],
  "primaryCategory": "2014",
  "section": "podcast"
}
