{
  "title": "4  The Holy Spirit as the Spirit of Truth",
  "legacyPath": "/podcast/category/4-the-holy-spirit-as-the-spirit-of-truth",
  "datePublished": "2024-08-25 20:43:06",
  "authors": [
    "manuelkuhs@gmail.com"
  ],
  "tags": [],
  "rawCategories": [
    "2008"
  ],
  "primaryCategory": "2008",
  "section": "podcast"
}
