{
  "title": "2004:5 Keeping God's Covenant and the Exercise of Discipline",
  "legacyPath": "/podcast/category/20045-keeping-gods-covenant-and-the-exercise-of-discipline",
  "datePublished": "2024-08-25 16:16:35",
  "authors": [
    "manuelkuhs@gmail.com"
  ],
  "tags": [],
  "rawCategories": [
    "2004"
  ],
  "primaryCategory": "2004",
  "section": "podcast"
}
