{
  "title": "2004:6 Keeping God's Covenant and the Antithetical Life",
  "legacyPath": "/podcast/category/20046-keeping-gods-covenant-and-the-antithetical-life",
  "datePublished": "2024-08-25 16:17:14",
  "authors": [
    "manuelkuhs@gmail.com"
  ],
  "tags": [],
  "rawCategories": [
    "2004"
  ],
  "primaryCategory": "2004",
  "section": "podcast"
}
