{
  "title": "2008:2  The Outpouring of the Holy Spirit",
  "legacyPath": "/podcast/category/20082-the-outpouring-of-the-holy-spirit",
  "datePublished": "2024-08-25 19:54:54",
  "authors": [
    "manuelkuhs@gmail.com"
  ],
  "tags": [],
  "rawCategories": [
    "2008"
  ],
  "primaryCategory": "2008",
  "section": "podcast"
}
